{
  "$schema": "https://json-schema.org/draft/2020-12/schema",
  "$id": "agent-tracer/mcp-manifest-v1",
  "title": "agent-tracer MCP server manifest (MCP/<name>/mcp.json)",
  "description": "Declares how the agent-tracer runner discovers and launches an MCP server placed under the MCP/ directory. One subdirectory = one server. Servers are auto-registered by default (default all); YAML config may narrow the set via mcp.include / mcp.exclude.",
  "type": "object",
  "required": [
    "manifest_version",
    "name",
    "description",
    "transport"
  ],
  "additionalProperties": false,
  "properties": {
    "$schema": {
      "type": "string",
      "description": "This schema, so an editor can complete and check the manifest as it is written. Every packaged manifest opens with \"../mcp.schema.json\"; declared here because additionalProperties is false and a manifest that names its schema must still validate against it."
    },
    "manifest_version": {
      "const": 1,
      "description": "Manifest schema version. Bump only with a coordinated runner change."
    },
    "name": {
      "type": "string",
      "pattern": "^[a-z][a-z0-9_-]*$",
      "description": "Server name. MUST equal the directory name (MCP/<name>/). Used in YAML include/exclude and as the tool namespace prefix (mcp:<name>/<tool>)."
    },
    "description": {
      "type": "string",
      "description": "One-line summary of what the server provides. Recorded in trajectory metadata."
    },
    "version": {
      "type": "string",
      "description": "Server implementation version (semver recommended). Recorded in trajectory metadata for reproducibility."
    },
    "transport": {
      "enum": [
        "stdio",
        "http"
      ],
      "description": "How the runner connects. stdio: runner spawns `command` and speaks MCP over stdin/stdout. http: runner connects to a streamable-HTTP endpoint at `url` (server lifecycle is external)."
    },
    "command": {
      "type": "string",
      "description": "Executable to spawn (stdio only). Required when transport is stdio. Resolved on PATH; use \"uv\" for uv-run based servers."
    },
    "args": {
      "type": "array",
      "items": {
        "type": "string"
      },
      "default": [],
      "description": "Arguments for command (stdio only). Relative paths are resolved against this manifest's directory."
    },
    "url": {
      "type": "string",
      "format": "uri",
      "description": "MCP endpoint URL (http only). Required when transport is http."
    },
    "env": {
      "type": "object",
      "additionalProperties": {
        "type": "string"
      },
      "default": {},
      "description": "Environment variables passed to the spawned process. A value of the form \"env:VAR_NAME\" (e.g. \"env:SEARCH_API_KEY\") is resolved from the runner's .env/environment at startup, and an unresolvable one aborts the run (fail-fast, consistent with api_key/reasoning_key). Any other value is passed on exactly as written — correct for a setting, never for a secret: a key written here is a key published with the repository."
    },
    "headers": {
      "type": "object",
      "additionalProperties": {
        "type": "string"
      },
      "default": {},
      "description": "HTTP headers sent with every request (http only). Same rule as env: \"env:VAR_NAME\" (e.g. \"env:CONTEXT7_API_KEY\") is resolved at startup and an unresolvable one aborts the run; anything else is sent exactly as written — correct for Accept, never for a key. Omit the property entirely on a stdio server; declaring it, even empty, is refused."
    },
    "sandbox_options": {
      "type": "boolean",
      "default": false,
      "description": "This server attaches to the task's sandbox and needs environment.options to do it (stdio only). Those options are where a backend's credentials go — e2b.attach() takes its API key from them — so AGENT_TRACER_OPTIONS is sent only to servers that declare this. The rest of the sandbox description (AGENT_TRACER_ENV_TYPE, _SANDBOX_ID, _WORKDIR, _HOST_DIR, _USER) goes to every server."
    },
    "startup_timeout_s": {
      "type": "number",
      "exclusiveMinimum": 0,
      "default": 15,
      "description": "Max seconds to wait for the server to complete the MCP initialize handshake before the run is aborted."
    },
    "call_timeout_s": {
      "type": "number",
      "exclusiveMinimum": 0,
      "default": 60,
      "description": "Default per-tool-call timeout in seconds. A timed-out call is recorded as a tool_result error event; the agent loop continues."
    },
    "tools": {
      "type": "array",
      "items": {
        "type": "object",
        "required": [
          "name",
          "description"
        ],
        "additionalProperties": false,
        "properties": {
          "name": {
            "type": "string"
          },
          "description": {
            "type": "string"
          }
        }
      },
      "description": "Optional declared tool list, for documentation and contract tests. The authoritative list always comes from MCP tool discovery at runtime; contract tests warn when the two diverge."
    }
  },
  "allOf": [
    {
      "if": {
        "properties": {
          "transport": {
            "const": "stdio"
          }
        }
      },
      "then": {
        "required": [
          "command"
        ]
      }
    },
    {
      "if": {
        "properties": {
          "transport": {
            "const": "http"
          }
        }
      },
      "then": {
        "required": [
          "url"
        ]
      }
    },
    {
      "if": {
        "properties": {
          "transport": {
            "const": "stdio"
          }
        }
      },
      "then": {
        "not": {
          "required": [
            "headers"
          ]
        }
      }
    }
  ]
}
